article_id,title,file_path,summary_le_200,tags,notes
A001,祭河开局,corpus/articles/A001-祭河开局.md,主角一开场就被推上祭台，危机和机缘绑在一起，适合高压仙侠开篇。,危机压身|仙侠/修仙,- 第一段先扔代价，不先讲世界观。 - 主角亮相要带选择，不要只写害怕。 - 章末钩子停在“更大的力量开口”，把危机直接翻成机缘入口。
A002,回门反打,corpus/articles/A002-回门反打.md,身份反差开局，主角不走认亲受气线，而是当场反打，把卖点前置。,真假千金|都市婚恋|身份反差,- 反差设定要立刻转成行动，不要停在委屈描写。 - 让主角做一个出人意料但能兑现卖点的动作。 - 章末最好把私人冲突升级成公开场域冲突。
A003,退婚对峙,corpus/articles/A003-退婚对峙.md,高张力对白要句句有后果，让旧情、权势和当下局势同时入场。,古言/宫廷|甜虐关系|重逢修罗场,- 对白里同时放旧账、现实筹码和新任务，张力才够。 - 关系拉扯不要只靠情绪，要靠谁握着什么筹码。 - 章末用突发事件把私人关系线硬接进主线。
A004,寿命追单,corpus/articles/A004-寿命追单.md,都市外挂文适合用异常信息切开日常，再迅速让主角卷进更危险的人和事。,都市婚恋|系统/外挂|危机压身,- 日常职业身份要尽快和异常能力碰撞。 - 先给小利益诱因，再把主角推入更大风险，选择才成立。 - 章末停在“不得不做的动作命令”，追读驱动力会更强。
A005,宗门立威,corpus/articles/A005-宗门立威.md,升级流章节除了压迫，也要给实感回报，让读者确认主角不是只会挨打。,仙侠/修仙|轻喜反差|危机压身,- 爽点要落地成公开翻盘，而不是只在心里出口气。 - 先让主角看懂局，再用证据反打，聪明感更稳。 - 回报给完以后立刻抬高下一层门槛，避免一章赢完就平。
A006,雨夜重逢,corpus/articles/A006-雨夜重逢.md,校园甜虐适合把重逢写成情绪失衡场，而不是单纯回忆杀。,校园|重逢修罗场|甜虐关系,- 重逢场要让身体反应先于回忆说明。 - 对白要让旧伤和当前关系位置同时出声。 - 章末最好抛一个能改写旧认知的证据，逼主角回头。
